assessmentId,internalTaxonId,scientificName,kingdomName,phylumName,orderName,className,familyName,redlistCategory,yearLastSeen,yearPublished,assessmentDate,criteriaVersion,language,rationale,habitat,threats,population,range,useTrade,systems,conservationActions,realm,scopes
78434814,12149,Litoria nyakalensis,ANIMALIA,CHORDATA,ANURA,AMPHIBIA,PELODRYADIDAE,Extinct,1990,2022,2021-02-03 00:00:00 UTC,3.1,English,"Listed as Extinct because it has not been recorded since 1990, and extensive searches over more than 20 years have failed to locate any individuals of this species. This species experienced very rapid declines, from being relatively common to extinct at each known locality within just a year or so, most likely due to chytridiomycosis.","This species was a rainforest specialist, endemic to the Wet Tropics Bioregion (Williams and Hero 1998, 2001), and found in upland rainforest and wet sclerophyll forest along fast-flowing streams where there is white water from riffles and cascades (Liem 1974, McDonald 1992). It was usually found perched on rocks or overhanging vegetation adjacent to the water (Liem 1974). Little is known about the life history of this species. Mating calls were heard from October to March (Liem 1974). From 86–90 large unpigmented eggs (1.9–2.5mm diameter) were laid under rocks in riffles (Richards 1993, Hero and Fickling 1996). Richards (1992) described the tadpole and noted that it was one of the few species of tadpole known to exhibit adaptations to torrent environments of Australia, including a streamlined body shape, large suctorial mouthparts and muscular tail. Tadpoles commonly overwintered in upland streams, although those hatching in early summer could metamorphose before the next autumn (Richards 1992).","This species is one of seven frogs occurring in upland rainforest streams in northeastern Queensland that experienced substantial range contractions and population declines between 1988 and late 1994 (Ingram and McDonald 1993, Richards et al. 1993, Northern Queensland Threatened Frogs Recovery Team 2001). These species share the common characteristics of having a high degree of habitat specialisation, and reproduction in fast flowing streams (Williams and Hero 1998). The declines are believed to be caused by the amphibian chytrid fungus (Batrachochytrium dendrobatidis) (Northern Queensland Threatened Frogs Recovery Team 2001) although dead or dying individuals of this species specifically were not found (Berger et al. 1999).Richard et al. (1993) rejected drought, floods, habitat destruction, or pollution by pesticides, inorganic ions or heavy metals as possible causes of the decline. The habitat of the species in the Wet Tropics has been protected since 1988; therefore, habitat destruction as a result of logging was no longer a threat (McDonald and Alford 1999). Feral pigs were a potential cause of riparian habitat damage and adult frog mortality (Richards et al. 1993). The activity of feral pigs has been recorded to have increased over the period 1989–1992 in an area previously inhabited by this species (Richards et al. 1993).","This species was once moderately common in suitable habitat, but then experienced a catastrophic decline. Adults were last recorded in April 1990, and tadpoles and metamorphs were last recorded in November 1990 on the Carbine Tableland (Richards et al. 1993). However, this species had apparently disappeared from sites on the Atherton Tableland much earlier (Richards et al. 1993). It was recorded from various sites on the Atherton Tableland prior to 1973 (Liem 1974), but was not encountered in Danbulla State Forest during 1989–1992 or at any Atherton Tableland site during surveys conducted between 1991 and 1992 (Richards et al. 1993). Surveys in the Wet Tropics conducted in 1991−1992, 1993 and 2011−2013 failed to locate the species from a number of historic locations and other potentially suitable habitat (Ingram and McDonald 1993, Richards et al. 1993, Trenerry et al. 1994, Hoskin and Puschendorf 2014), and Hoskin and Puschendorf (2014) concluded that the Mountain Mistfrog could be considered extinct. The Conservation Advice published for this species summarises the extensive survey efforts from 1989 to 2013 that were unsuccessful in locating any extant populations (Threatened Species Scientific Committee 2019). Gillespie et al. (2020) have now declared this species extinct.","This Australian endemic species was distributed across two thirds of the Wet Tropics from Douglas Creek near Cardwell to Alexandra Creek, Thornton Peak in northeast Queensland (Hero and Fickling 1994) at altitudes between 380 and 1,020 m asl (McDonald 1992).",There was no use or trade of this species.,Terrestrial|Freshwater (=Inland waters),"Conservation Actions In-PlaceThe habitat of the species in the Wet Tropics has been protected since 1988. Historically it was known from Wooroonooran, Daintree, Crater Lakes, Crater and Palmerston National Parks, Mt Lewis, Maalan, Ravenshoe, Herberton Range, and Kirrama State Forests, and SF758 Alcock, Daintree Timber Reserve (165 Monkhouse) (Tyler 1997). A recovery plan for the Mountain Mistfrog was developed in 2001 by the Northern Queensland Threatened Frogs Recovery Team (2001).",Australasian,Global
78447380,21529,Taudactylus acutirostris,ANIMALIA,CHORDATA,ANURA,AMPHIBIA,MYOBATRACHIDAE,Extinct,1997,2022,2021-02-03 00:00:00 UTC,3.1,English,"Listed as Extinct because it has not been recorded in the wild since 1997, and extensive searches over the last 20 years have failed to locate this species. This species experienced a very rapid decline, from being relatively common to extinct in only five or so years, most likely due to chytridiomycosis.","The species was known to be a habitat specialist, endemic to the Wet Tropics Bioregion (Williams and Hero 1998, 2001) occurring along small creeks in rainforest and wet sclerophyll forest (Liem and Hosmer 1973). The species was seen on rocks during the day near swift-flowing streams or in the rainforest leaf-litter during wet weather (McDonald 1992). Males called during the day, from first light to early evening, near rainforest streams from beneath rocks or leaves (McDonald 1992). Males appeared to establish territories, possibly as a response to seemingly low numbers of females (Dennis 1982). Breeding was observed from late November through to January (Liem and Hosmer 1973). Eggs were laid as a gelatinous clump of about 25–40 eggs (2.2–2.7mm diameter) amongst rocks in the water usually in heavily shaded locations (Liem and Hosmer 1973). Liem and Hosmer (1973) described the tadpole of the species as lotic benthic. Tadpoles generally inhabited debris in pools or slow flowing sections of streams (Liem and Hosmer 1973).","Richards et al. (1993) found no obvious evidence that drought, floods, habitat destruction or pollution by pesticides, inorganic ions or heavy metals were responsible for the population declines seen in this species. Big Tableland, the area where the species was at its highest density in 1991–1992, has been mined since 1887 and logging ceased in that area in 1963 (Richards et al. 1993). Rather, research suggests the rapid, catastrophic decline of this species was due to infection with chytridiomycosis (Berger et al. 1999, Schloegel et al. 2006). Chytrid fungus has been identified on specimens of this species from the Carbine Tableland and Big Tableland (Speare and Berger 2000).Feral pigs are a potential cause of riparian habitat damage and adult frog mortality (Richards et al. 1993). The activity of feral pigs has been recorded to have increased over the period 1989–1992 in an area previously inhabited by this species (Richards et al. 1993). There is very little research, however, into the impact of feral pigs on native frog populations (Richards et al. 1993).","Formerly a conspicuous inhabitant of upland rainforest streams because of its diurnal habits and historical abundance, the species started disappearing in the southern part of its range in 1988 and had disappeared from south of the Daintree River by 1992 (Richards et al. 1993). In the past the species was considered locally abundant and in 1989, 48 calling males were recorded along a 100 m stream transect (Richards et al. 1993). When surveys of the same site were undertaken in 1990, only one adult and several tadpoles were located (Richards et al. 1993). The rapid decline of this species is well documented and, in approximately five years from 1988 to 1993, it disappeared from an area spanning about 2.5 degrees latitude (Ingram 1993). Possible sightings of a single individual in a small tributary of the South Johnstone River in 1996 (Marshall 1998), and in 1997, a gravid female seen near Mount Hartley (Hero et al. 1998), are the only records of the species since 1994 (Hero et al. 2002, Schloegel et al. 2006). Apart from these two individuals, it has not been recorded during extensive searches of suitable, known sites from the previous range of this species between 1994 and 2004 (Hero and McDonald, personal communication in Schloegel et al. 2006), and more recent extensive surveys in the region have still failed to find any individuals and it is now believed that this species is extinct (Conrad Hoskin pers. comm. 2016, Gillespie et al. 2020).","This Australian endemic species was widely distributed from Mount Graham to the Big Tableland, in northeast Queensland, at altitudes of 300–1,300 m asl (McDonald 1992).",There was no use or trade of this species.,Terrestrial|Freshwater (=Inland waters),"Conservation Actions In-PlaceIts historical range included Lumholtz, Wooroonooran, Daintree, Crater, Cedar Bay, and Tully Falls National Parks, as well as Qld Timber Reserve (165 Monkhouse), Lamb Range, Malbon Thompson Range, Herberton Range, Ravenshoe, Kirrama Range, Mt Fisher, Maalan, Mt Lewis, and Windsor State Forests (Tyler 1997). There was a captive-rearing programme run by the Melbourne Zoo and the Queensland Department of the Environment, that started in 1996. Tadpoles were raised to metamorphosis and a single frog to adult stage, but all subsequently succumbed to chytridiomycosis. There are no longer any animals in captivity. A recovery plan for this species was developed in 2001 by the Northern Queensland Threatened Frogs Recovery Team (2001).",Australasian,Global
78447626,21530,Taudactylus diurnus,ANIMALIA,CHORDATA,ANURA,AMPHIBIA,MYOBATRACHIDAE,Extinct,1979,2022,2021-02-03 00:00:00 UTC,3.1,English,"Listed as Extinct because it has not been recorded in the wild since 1979, and extensive searches over the last 40 years have failed to locate this species. This species experienced a very rapid decline, from being relatively common to extinct in only three or four years, most likely due to chytridiomycosis.","The species was associated with permanent and temporary watercourses in montane rainforests, tall open forest, notophyll vine forest and sclerophyll fern forest (Czechura and Ingram 1990). In addition, animals were also found along watercourses in pure stands of the palm Archontophoenix cunninghamia, in exposed areas, in gorges, in dense non-forest riparian vegetation (Lomandra longifolia, Carex neurochlamys, Elatostema reticulatum and Blechnum nudum) and where the riparian vegetation had been slightly infested with Lantana camara (Czechura and Ingram 1990). Permanent streams with rocky substrates were favoured, but this species also occurred in permanent and ephemeral streams on gravel, clay, sand and soil substrates (Czechura and Ingram 1990). Active frogs had been observed all year round, although less frequently during winter months (Czechura and Ingram 1990). Breeding occurred in warm weather after or during heavy rain from late October to May, with a January to March peak (Czechura and Ingram 1990, Meyer et al. 2001). Gravid females had been reported between November and May (Straughan and Lee 1966). Amplexus was inguinal and 24–36 eggs (2.2 mm diameter) were deposited in gelatinous clumps under rocks or branches in the water (Liem and Hosmer 1973, Watson and Martin 1973, Czechura and Ingram 1990, Meyer et al. 2001). Tadpoles, illustrated by Liem and Hosmer (1973) and Watson and Martin (1973), were found throughout the year.","The reason(s) for the disappearance of this species remains unknown. Like Rheobatrachus silus, logging has occurred in catchments occupied by the species (Hines et al. 1999); however, the effect of timber harvesting on the species has not been investigated. The species’ habitat is currently threatened by feral pigs, invasion of weed species (especially Mist Flower) and altered stream flow and water quality due to upstream disturbances (Hines et al. 1999). The species was not found in areas along watercourses that were heavily infested with Lantana camara or where the weeds Baccharis halimifolia and Ageratina riparia (Mist Flower) occurred (Czechura and Ingram 1990). The frogs were also absent from streams with very muddy water associated with the activities of feral pigs (Czechura and Ingram 1990). From what is known from similar declines and disappearance elsewhere in the world, the disease chytridiomycosis also must be suspected as a cause for the decline.","In the early 1970s this species was considered to be relatively common (McEvoy et al. 1979), but following a very rapid decline it has not been sighted in the wild since 1979 despite continued efforts to relocate the species (Hines et al. 1999). The disappearance of the species occurred over a period of three to four years, disappearing from the D’Aguilar Range in late 1975, then from the Blackall Range in late 1978, and finally from the Conondale Range in early 1979 (Czechura and Ingram 1990). There is no information on population size, structure, genetics or dynamics (Hines et al. 1999). This species is now believed to be extinct.","This Australian endemic species occurred in disjunctive subpopulations in three sub-coastal mountain ranges (Blackall, Conondale, and D’Aguilar Ranges) in southeast Queensland from Coonoon Gibber Creek in the north, to Mount Glorious in the south (Czechura and Ingram 1990, Hines et al. 1999). The extent of occurrence (EOO) of the species was about 1,400 km2 (map in Hines et al. 1999). The species occurred over a relatively narrow altitudinal range of 350-800 m asl with most records falling between 500–800 m asl (Czechura and Ingram 1990).",There was no use or trade of this species.,Terrestrial|Freshwater (=Inland waters),"Conservation Actions In-PlaceThe species was formerly known from Kondalilla, Conondale, Mapleton Falls, Obi Obi Gorge, Maiala, and Manorina National Parks (Tyler 1997).",Australasian,Global
82310440,6923,Dusicyon australis,ANIMALIA,CHORDATA,CARNIVORA,MAMMALIA,CANIDAE,Extinct,1876,2015,2015-08-13 00:00:00 UTC,3.1,English,"Dusicyon australis was endemic to the Falkland Islands. It was discovered in 1690 and was still present when Charles Darwin visited the Falklands in 1833-1834. However, throughout the 1800s, the population declined drastically due to persecution. The last individual is believed to have been killed in 1876.","There is no information available on specific habitats favoured by this species. Falkland Islands habitat generally comprises rocky scrub, marsh and grassland, and dwarf shrub heath (Falklands Conservation 2012).","The species was hunted by Argentine settlers in early 1800s, and by US fur traders in the 1830s. Due to being tame and curious and unafraid of humans, it was particularly susceptible to culling. Scottish settlers and their sheep flocks arrived in the 1860s and considered D. australis a pest and a threat to their sheep, setting fire to brushwood and laying out poison baits.","Dusicyon australis probably reached the Falkland Islands from the mainland 480 km away during the last glacial age (Slater et al. 2009). A close relative, D. avus, may have persisted in the Pampean and Patagonian regions of Argentina until after 1500 (Prevosti et al. 2015). The Falklands Wolf was discovered in 1690 and was still present when Charles Darwin visited the Falklands in 1833-1834. However, the population of West Falkland was already declining rapidly by then, and by 1865 it was no longer found on the eastern part of East Falkland. The last Falklands Wolf is believed to have been killed in 1876 at Shallow Bay, West Falkland Islands.","The Falklands Wolf was endemic to the Falkland Islands, and was present in both West and East Falklands.","The species was hunted by Argentine settlers in early 1800s, and by US fur traders in the 1830s.",Terrestrial,"A Falklands Wolf was taken to Britain and lived in the London Zoo in 1868. In 1870, the surviving member of a pair of animals sent by Mr Byng, the acting colonial secretary of the Falklands, arrived in London Zoo. It lived for a few years. However, no reproduction in captivity was reported.",Neotropical,Global
82337485,82337482,Dusicyon avus,ANIMALIA,CHORDATA,CARNIVORA,MAMMALIA,CANIDAE,Extinct,1464–1636,2015,2015-08-13 00:00:00 UTC,3.1,English,"Dusicyon avus was found in the southern parts of South America. Radiocarbon evidence indicates a very recent disappearance (about 324–496 years cal BP), concurrent with European colonisation of this region. This species is the sister taxon of the also extinct, but insular, Falklands Wolf Dusicyon australis.","The species occupied relatively open habitats, such as grass steppe and shrub steppes, in the Pampean and Patagonian regions.","The demise of the species has been linked to habitat changes, hybridization with dogs and persecution. The abundant fossils of Dusicyon avus show a clear archaeological and temporal overlap with modern humans. A specimen was discovered in a grave from the late second millennium BC, suggesting that the animal might have been kept as a pet (Prates 2014); the teeth of Dusicyon avus were used in a religions context in some aboriginal sites of Buenos Aires province. According to new radiocarbon evidence, the species would have become extinct about 326-496 years BP (Prevosti et al. 2015), supporting the hypothesis that its disappearance might have happened after the arrival of Europeans. Anecdotal evidence exists from the diaries of 19th century naturalists and explorers of a large canid in Patagonia attributable to Dusicyon avus. Prevosti et al. (2015) found no evidence for hybridization, and proposed that the drivers of the recent extinction of the species were anthropogenic impacts, including hunting and domestic dogs, coupled with climatic change. The indigenous Ona of Tierra del Fuego recognized two species of fox, one of a large size.",The species had a widespread distribution and would have conceivably been relatively common.,"Dusicyon avus lived in the Pampean and Patagonian regions of Argentina, southern Chile, Uruguay and southern Brazil. The species has a rich fossil record, based on several Late Pleistocene localities, and a few Holocene records (in the southern parts of its range).","A specimen was discovered in a grave from the late second millennium BC, suggesting that the animal might have been kept as a pet (Prates 2014); the teeth of Dusicyon avus were used in a religions context in some aboriginal sites of Buenos Aires province.",Terrestrial,This species is now extinct.,Neotropical,Global
83321765,11559,Lepidodactylus listeri,ANIMALIA,CHORDATA,SQUAMATA,REPTILIA,GEKKONIDAE,Extinct in the Wild,2012,2017,2017-02-20 00:00:00 UTC,3.1,English,"The species was considered to be abundant in 1979 (Cogger et al. 1983), but it has undergone a decline in numbers, and surveys in 1998 and 2008 did not successfully locate any individuals. Many recent intensive surveys in the island, at appropriate times, seasons, and habitats have not recorded the species again. The last individual recorded in the wild was in 2012 (Parks Australia). There is a successful captive breeding program and the population is increasing. The species is therefore listed as Extinct in the Wild.","This species was most abundant within primary forest of the plateau, and was able to adapt to disturbed habitat and secondary growth with mature trees (Cogger 2006). It was least abundant on the terraces on the northeastern, eastern and southern sides of the island and absent in all mined areas (Cogger 2006). This species is nocturnal and arboreal and shelters during the day under bark (Cogger 2006). This species has a clutch size of two and a maximum snout-vent length of 51.5 mm (Cogger 2005). This species is almost entirely arboreal (Cogger 2005).","The main threat to this species was predation by the introduced Wolf Snake (Lycodon capucinus), which is presumed to have driven the species to near-extinction in the wild following its arrival on the island in around 1982; the majority of the remaining wild population was taken into captivity from 2009 and the wild population has apparently subsequently been lost. Secondary threats are likely to have existed from other exotic predators, including Yellow Crazy Ants (Anoplolepis gracilipes), feral cats, rats and an invasive centipede (Scolopendra subspinipes) (Andrew et al. 2016) - most of these species have, however, been established for a century or more and cannot be considered major drivers of the observed decline, while crazy ant populations are concentrated in coastal and near coastal areas rather than the plateau. The captive population was infected by the Enterococcus virus, probably originating in Asia, however, this may not be a severe threat as the captive population is increasing.","The species was considered to be abundant in 1979 (Cogger et al. 1983), but it has undergone a decline in numbers, and surveys in 1998 and 2008 did not successfully locate any individuals. From August 2009 as many individuals as possible were taken into captivity, a total of 43 animals, in order to develop a captive breeding programme (Andrew et al. 2016). Many recent intensive surveys in the island, at appropriate times, seasons, and habitats have not recorded the species. The last individual recorded in the wild was in 2012 (Andrew et al. 2016). There is a successful captive breeding programme and the population is increasing.","This species was endemic to Christmas Island in the Indian Ocean. It was last recorded in October 2012 (Andrew et al. 2016) despite subsequent extensive surveys, and is now considered to be extinct in the wild.","There is no known use of or trade in the species, which no longer appears to survive as a wild population.",Terrestrial,"This species is currently listed as Critically Endangered under the Environment Protection and Biodiversity Conservation Act (1999), an act of the Australian government. This species range also coincides with the Christmas Island National Park. In 2009 a captive breeding programme was established on Christmas Island, with another population established at Taronga Zoo in 2011 (Threatened Species Scientific Committee 2014). Andrew et al. (2016) reports that the Christmas Island captive population then contained 70 individuals, and the Taronga population was established from 56 animals. Reintroduction of this species to the wild is not feasible in the forseeable future, as it is not presently possible to eradicate Wolf Snakes and other exotic predators from Christmas Island.",Indomalayan,Global
89815479,157719927,Chitala lopis,ANIMALIA,CHORDATA,OSTEOGLOSSIFORMES,ACTINOPTERYGII,NOTOPTERIDAE,Extinct,1851,2020,2019-08-29 00:00:00 UTC,3.1,English,"This species was known only from river drainages in western and central Java. It has not been recorded from this region in over 160 years, despite extensive surveys since its first collection. Threats in the region have resulted in severe habitat degradation that has led to the extirpation of many large-bodied freshwater fish species, and include pollution from industrial, domestic, and agricultural inputs, extensive and unsustainable fishing practices, severe land conversion for urban and agricultural development (including near complete deforestation). Given a lack of reports over an extended period of time despite extensive sampling, Chitala lopis is assessed as Extinct.","Juveniles of this species most likely inhabit forested streams and swamp forests, while adults were more likely found in lakes and large rivers, as reported for other congeners (Bleeker 1851, Kottelat and Widjanarti 2005).","Logging, deforestation, urban development, extensive and unsustainable fishing, pollution resulting from industrial, domestic, and agricultural point and non-point sources, and agriculture occur extensively in western and central Java (D. Lumbantobing pers. comm. 2019).","This species is considered extinct, as it has not been encountered since the mid 19th century (Kottelat and Widjanarti 2005, Dahruddin et al. 2017).","This species was known only from river drainages in Java, from the Pesanggrahan River drainage eastwards to the Kali Garang River drainage (Bleeker 1851, Kottelat and Widjanarti 2005). The historical extent of occurrence (EOO) when this species was extant is estimated at 15,920 km2, based on a minimum convex polygon calculated from its known historic distribution (Bleeker 1851).",This species was consumed as a food fish in subsistence fisheries.,Freshwater (=Inland waters),No conservation actions are needed as the species is extinct.,Indomalayan,Global
