assessmentId,internalTaxonId,scientificName,kingdomName,phylumName,orderName,className,familyName,redlistCategory,yearLastSeen,yearPublished,assessmentDate,criteriaVersion,language,rationale,habitat,threats,population,range,useTrade,systems,conservationActions,realm,scopes
230879957,22692801,Porphyrio albus,ANIMALIA,CHORDATA,GRUIFORMES,AVES,RALLIDAE,Extinct,1790,2023,2023-03-23 00:00:00 UTC,3.1,English,"This species was known from Lord Howe Island, Australia, but has not been definitely recorded since 1790 and was Extinct by the time the island was settled in 1834. Hunting was the major cause of its decline.",Nothing is known; it may have inhabited forest or marshland.,It was hunted to extinction by whalers and sailors.,None remain.,"Porphyrio albus is known from two skins in Liverpool (U.K.) and Vienna (Austria) (Taylor and van Perlo 1998), several paintings, and some subfossil bones from Lord Howe Island, Australia (Marchant and Higgins 1993). Although not uncommon when discovered in 1788, the species was rapidly hunted to extinction; it had probably already vanished by the time the island was colonised in 1834 (Hindwood 1940).",This species was hunted.,Terrestrial,,Oceanian,Global
230907670,62263064,Porphyrio paepae,ANIMALIA,CHORDATA,GRUIFORMES,AVES,RALLIDAE,Extinct,1937,2023,2023-03-24 00:00:00 UTC,3.1,English,"This species may have survived until as late as 1937, but undoubtedly became Extinct soon after. It likely disappeared as a result of over-hunting and predation by invasive rats and cats.",This species was a small gallinule which probably had reduced flying capabilities (Hume and Walters 2012).,"Little is known, but it was presumably driven to extinction by hunting pressure and predation by invasive species.",No extant population remains.,"Porphyrio paepae was known from Hiva Oa and Tahuata on the Marquesas Islands (French Polynesia). It may have survived as late as 1937, but must have become extinct soon afterwards (Steadman 1988, Hume and Walters 2012).",This species was likely hunted.,Terrestrial|Freshwater (=Inland waters),,Oceanian,Global
230908300,22728732,Porphyrio kukwiedei,ANIMALIA,CHORDATA,GRUIFORMES,AVES,RALLIDAE,Extinct,1860,2023,2023-03-24 00:00:00 UTC,3.1,English,"This species is known from New Caledonia's Grande Terre, but has not been recorded since 1860 and is now Extinct. Hunting and invasive species were the principal drivers of its decline.",It probably inhabited marshland.,Hunting and the depredations of introduced predators are likely to have driven it to extinction.,No extant population remains.,"Porphyrio kukwiedei is known only from subfossil remains from New Caledonia (to France). However, a passage from Verreaux and des Murs written in 1860 notes the presence of birds the size of turkeys in marshy areas, and so it is possible that the species survived into the 19th century (Balouet and Olson 1989).",The species was likely hunted.,Freshwater (=Inland waters),,Australasian,Global
230909124,22728833,Porphyrio mantelli,ANIMALIA,CHORDATA,GRUIFORMES,AVES,RALLIDAE,Extinct,1894,2023,2023-03-24 00:00:00 UTC,3.1,English,"This species was endemic to New Zealand's North Island, but has been driven Extinct by human-induced habitat changes, hunting and predation by introduced mammals. There has been only one historical record of the species, in 1894.",It inhabited high altitude alpine grasslands.,"The decline of the species has generally been attributed to the increasing incursion of forest into the alpine grasslands through the Holocene (Mills et al. 1984), although hunting by the Maori probably also played a significant role (Beauchamp and Worthy 1988). Predation by introduced mammals also likely contributed to declines (Hume 2017).",None remain.,"Porphyrio mantelli was a flightless endemic to North Island, New Zealand, from where it is known from subfossils from a number of archeological sites (Williams 1960) and from one possible late 19th century record (Phillipps 1959).",This species was likely hunted.,Terrestrial,,Australasian,Global
230910452,62274163,Tribonyx hodgenorum,ANIMALIA,CHORDATA,GRUIFORMES,AVES,RALLIDAE,Extinct,1600-1700,2023,2023-03-24 00:00:00 UTC,3.1,English,"This species likely became Extinct during the 17th century as a result of predation by rats and hunting by human settlers, although may have survived in remote areas until the 18th century.","Remains were found at widely spread locations on both the North and South Islands of New Zealand, indicating that it was presumably common prior to the arrival of the Polynesians and associated commensal animals. It was likely a forest inhabitant and may have also occurred in riparian swards and open forest glades (Hume 2017).","The main reasons for its extinction are likely to have been predation by Polynesian rats, and hunting by human settlers.",None persisted to modern times.,"Tribonyx hodgenorum is known from subfossil remains on the North and South Islands of New Zealand. It was apparently widespread, but the youngest specimen material dates from the 17th century. However, it may have survived in remote areas until the 18th century (Hume 2017).",The species was likely hunted.,Terrestrial|Freshwater (=Inland waters),,Australasian,Global
230913278,22697307,Ixobrychus novaezelandiae,ANIMALIA,CHORDATA,PELECANIFORMES,AVES,ARDEIDAE,Extinct,1890,2024,2023-09-30 00:00:00 UTC,3.1,English,"This species was known from New Zealand's North and South Island, but became Extinct for unknown reasons some time in the 1890s.",It is likely to have inhabited freshwater wetlands and saltwater lagoons (Hume 2017).,"Reasons for its extinction are not known, but introduced predators and hunting are responsible for the demise of most of New Zealand's endemic species.",No extant population remains.,"Ixobrychus novaezelandiae was endemic to New Zealand, known from North and South Island (Hume 2017).",,Freshwater (=Inland waters),,Australasian,Global
230915546,22732926,Pomarea fluxa,ANIMALIA,CHORDATA,PASSERIFORMES,AVES,MONARCHIDAE,Extinct,1977,2023,2023-03-24 00:00:00 UTC,3.1,English,"This species was endemic to the island of Eiao, French Polynesia, but is now Extinct, probably due to predation by introduced predators. It was last recorded in 1977, and subsequent searches have failed to find it.",It inhabited lowland dry forest.,"Introduced predators including feral cats, Polynesian Rat Rattus exulans and possibly Black Rat R. rattus were present on the island at the time of the species' demise, and may have contributed to declines. The introduction of Chestnut-breasted Mannikin Lonchura castaneothorax coincided with its extinction on the island, implying that an avian disease may have been transmitted to this population (Thibault 1989). Native low-elevation dry forest has drastically decreased due to intense grazing by sheep introduced c.1880 (Holyoak and Thibault 1984, Thibault and Meyer 2001), and this may have been an additional factor.",None are believed to remain.,"Pomarea fluxa was endemic to the Marquesas Islands, French Polynesia, where it was restricted to the small, uninhabited island of Eiao. Despite a number of searches in 1987 and since (Thibault and Meyer 2001), it has not been seen since 1977, and is considered to be extinct (Thibault 1989, Cibois et al. 2004).",,Terrestrial,,Oceanian,Global
230916441,22732936,Pomarea nukuhivae,ANIMALIA,CHORDATA,PASSERIFORMES,AVES,MONARCHIDAE,Extinct,1930s,2023,2023-03-24 00:00:00 UTC,3.1,English,"This species was endemic to the island of Nuku Hiva, French Polynesia, but it has been driven Extinct by habitat changes and introduced predators. The last records date from the 1930s; a survey in 1972 failed to locate it.",This mainly insectivorous species occurred in forested valleys at high elevations and in degraded forest at all altitudes (probably originally preferring lowland forests which are now destroyed).,"All the Marquesas Islands have been devastated by intense grazing and fire, and much of the original dry forest has been reduced to grassland, and upland forest to relict forest patches. Introduced species are also likely to have played a role in the species' demise, especially Black Rat Rattus rattus.",None believed to remain.,"Pomarea nukuhivae was formerly endemic to the island of Nuku Hiva in the Marquesas Islands, French Polynesia. It was considered not common in 1922 and rare in the 1930s, the last confirmed sightings. It was not seen in 1972 or 1975 despite several weeks of intensive searches. There were unconfirmed sightings in 1975 by two hunters of a passerine bird matching this species' description, but these are extremely doubtful and the species was not seen in 1997 or 1999 (Thibault and Meyer 2001, Hume 2017).",,Terrestrial,,Oceanian,Global
230926240,22704329,Moho apicalis,ANIMALIA,CHORDATA,PASSERIFORMES,AVES,MOHOIDAE,Extinct,1837,2023,2023-03-24 00:00:00 UTC,3.1,English,"This species was known from the Hawaiian island of O'ahu, USA, but is now Extinct as a result of habitat loss and introduced disease. The last record dates from 1837, and it was not found by the collectors that visited the island in the 1890s.","Nothing is known, though it is likely to have been similar to the other members of the genus.",Its extinction was presumably caused by a combination of habitat destruction and the introduction of disease-carrying mosquitoes (Pratt 1994). Hunting for its feathers was also likely a contributing factor (Hume 2017).,None remain.,"Moho apicalis was restricted to forest on O'ahu, Hawai'i, USA (Pratt et al. 1987). It is known only from around seven specimens, the last three of which were collected by Ferdinand Deppe in the hills behind Honolulu in 1837. None of the collectors visiting O'ahu between 1890 and 1900 found any trace of it (Greenway 1967), and it is now considered Extinct.",The species was hunted for its feathers (Hume 2017).,Terrestrial,,Oceanian,Global
230929845,22704335,Moho bishopi,ANIMALIA,CHORDATA,PASSERIFORMES,AVES,MOHOIDAE,Extinct,1904,2023,2023-03-24 00:00:00 UTC,3.1,English,"This species was formerly found in the Hawaiian Islands, USA, but there have been no confirmed records since 1904 and is now considered Extinct. A single bird thought to be this species was observed in 1981 on the north-east slope of Haleakala but there have been no further confirmed records despite intensive searching. Habitat loss, predation and disease were the likely causes of its extinction.",It occurred in low and high altitude moist forest.,"Habitat destruction caused by conversion to agriculture and grazing by feral mammals inevitably initiated the species' decline, with introduced black rat Rattus rattus and the spread of disease carried by introduced mosquitoes blamed for the population crash early in the 20th century (Pratt 1994).",None remain.,"Moho bishopi was a forest bird endemic to the Hawaiian Islands, USA (Pratt et al. 1987). It was last recorded on Moloka'i in 1904 by Munro (1944), who received local reports of its survival until 1915, but could find no more birds despite numerous further searches up until 1949. There is very little historical information about its occurrence on Maui, and although a single bird believed to be this species was observed in 1981 on the north-east slope of Haleakala (Sabo 1982), there have been no further confirmed records despite intensive searching (Collar et al. 1994) and the species is presumed extinct (Reynolds and Snetsinger 2001).",,Terrestrial,,Oceanian,Global
230938174,22704342,Moho nobilis,ANIMALIA,CHORDATA,PASSERIFORMES,AVES,MOHOIDAE,Extinct,1902,2023,2023-03-24 00:00:00 UTC,3.1,English,"This species was known from the Big Island of Hawai`i, but was last collected in 1902 with one unconfirmed record in 1934. It is now Extinct. Habitat destruction, hunting and introduced disease were probably the major causes.",It was found in moist montane forest.,"Its decline to extinction was presumably caused by habitat destruction, disease and hunting (Hume 2017).",None remain.,"Moho nobilis was only found in forest on the Big Island of Hawai`i, USA (Pratt et al. 1987). It was last collected in 1902 but there was an unconfirmed record in 1934 (Munro 1944, Hume 2017).",This species was hunted for its yellow plumes and for museum skins (Hume 2017).,Terrestrial,,Oceanian,Global
230941073,22704348,Chaetoptila angustipluma,ANIMALIA,CHORDATA,PASSERIFORMES,AVES,MOHOIDAE,Extinct,1859,2023,2023-03-24 00:00:00 UTC,3.1,English,"This species was known from the Hawaiian Islands, USA, but it has not been recorded since a specimen was collected in 1859. Deforestation, hunting and introduced predators are likely to have contributed to this species' extinction.",It was restricted to montane plateau forest and fed on nectar (Amante-Helweg et al. 2009).,"Deforestation, hunting and introduced predators are likely to have contributed to this species' extinction.",None remain.,"Chaetoptila angustipluma is known historically only from the Big Island of Hawaii, USA. Only four specimens were ever collected, between 1840 and 1859 (Greenway 1967).",,Terrestrial,,Oceanian,Global
230946240,22704323,Moho braccatus,ANIMALIA,CHORDATA,PASSERIFORMES,AVES,MOHOIDAE,Extinct,1987,2023,2023-03-24 00:00:00 UTC,3.1,English,"This species was known from the Hawaiian island of Kaua'i, USA, but it is now Extinct having been last seen in 1985 with one possible recording in 1987. Habitat destruction and invasive species were the major causes.",It was common in forests from sea level to the highest elevations.,"Habitat destruction and the introduction of black rat Rattus rattus, pigs and disease-carrying mosquitoes to the lowlands were the probable causes of this species' extinction (Collar et al. 1994).",None remain.,"Moho braccatus was endemic to Kaua'i, Hawaii, USA. It was common in the 1890s, but declined drastically during the early 20th century (Pratt et al. 1987). By the 1970s, it was confined to the Alaka'i Wilderness Preserve (Pratt 1994). In 1981, a single pair remained, the female of which was not found after Hurricane Iwa in 1982, the male being last seen in 1985. The last possible report, of vocalisations only, was in 1987, and the species has not been recorded during subsequent surveys of Alaka'i (Conant et al. 1998, Hume 2017).",,Terrestrial,,Oceanian,Global
230949308,22705595,Turnagra capensis,ANIMALIA,CHORDATA,PASSERIFORMES,AVES,ORIOLIDAE,Extinct,1905,2023,2023-03-24 00:00:00 UTC,3.1,English,"This species is known from New Zealand's South Island, but is now Extinct as a result predation and habitat destruction. The last confirmed record was of the nominate subspecies, in 1905.",It was observed foraging in native forest undergrowth.,"Its extinction was probably mainly due to predation by introduced mammals (Greenway 1967), but habitat destruction is likely to have been a contributing factor.",None remain.,"Turnagra capensis, according to Walter Buller, was common until 1863 on the South Island, New Zealand, from where it is known from numerous specimens (Greenway 1967). However, the species declined very rapidly in the 1880s, and the definite record was from 1905 (Tennyson and Martinson 2006). There have been unconfirmed reports since, including in 1963 (Knox and Walters 1994).",,Terrestrial,,Oceanian,Global
230957445,22728820,Turnagra tanagra,ANIMALIA,CHORDATA,PASSERIFORMES,AVES,ORIOLIDAE,Extinct,1902,2023,2023-03-24 00:00:00 UTC,3.1,English,"This species is known from New Zealand's North Island, but has been driven Extinct by habitat loss and predation. The last confirmed record dates from 1902, and there have been no reports at all since 1970.","Very little is known, although it is likely to have required large tracts of primary native forest.","Presumably both habitat destruction and direct predation by people, cats and rats caused the species' extinction (Greenway 1967).",None remain.,"Turnagra tanagra was endemic to the North Island, New Zealand. Walter Buller described it as common in the 1870s, but there were few specimens ever collected (specimens are only known to exist in Chicago, Philadelphia (USA), Tring (U.K.) and Wellington (New Zealand)), the last being from 1902. Occasional unconfirmed sight records persisted until 1970 (Tennyson and Martinson 2006).",,Terrestrial,,Oceanian,Global
231049026,22714223,Zosterops strenuus,ANIMALIA,CHORDATA,PASSERIFORMES,AVES,ZOSTEROPIDAE,Extinct,1908,2023,2023-03-27 00:00:00 UTC,3.1,English,"This species was endemic to Lord Howe Island, Australia, but it is now Extinct due to overpredation by introduced rats. It was last recorded in 1908, and not found on a survey in 1928.","It inhabited lowland forest, palm glades and the scrubby vegetation of more open and settled areas. It probably fed on fruit, insects, flowers and other birds' eggs (Garnett et al. 2011).",The cause of its extinction was predation by Black Rats.,No extant population remains.,"Zosterops strenuus was endemic to lowland forests on Lord Howe Island, Australia (Stattersfield et al. 1998). It was very common before 1918 (McAllan et al. 2004), with the last records coming from 1908 (Hull 1909), but it plummeted to extinction following the arrival of Black Rats Rattus rattus on the island in 1918 (Hindwood 1940, Hume 2017). It could not be found in 1928 (Sharland 1929).",,Terrestrial,,Australasian,Global
231051969,103889155,Zosterops conspicillatus,ANIMALIA,CHORDATA,PASSERIFORMES,AVES,ZOSTEROPIDAE,Extinct,1983,2023,2023-03-27 00:00:00 UTC,3.1,English,"The last known sighting was in 1983, and the species is considered Extinct.",Similar to the extant Z. saypani the species is thought to have been found in a wide range of habitats from native limestone forest to scrubby secondary growth of disturbed habitats and even urban areas.,The species' demise is thought to be due to the invasive Brown Tree Snake Boiga irregularis (van Balen 2016). In 1976 its habitat was also devastated by super-typhoon Pamela (Hume 2017).,This species is extinct.,"Zosterops conspicillatus was formerly found on Guam, last recorded in 1983 and is now extinct (del Hoyo et al. 2008). The introduction of the Brown Tree Snake Boiga irregularis is the most likely cause (van Balen 2016, Hume 2017).",,Terrestrial,,Oceanian,Global
231057904,22707354,Myiagra freycineti,ANIMALIA,CHORDATA,PASSERIFORMES,AVES,MONARCHIDAE,Extinct,1983,2024,2023-09-29 00:00:00 UTC,3.1,English,"This species formerly occurred on Guam, but became Extinct in 1983. Predation by the introduced brown tree snake was the cause of its extinction.",It inhabited forest.,Its rapid decline to extinction was due to the depredations of introduced brown tree snake Boiga irregularis (Savidge 1987).,No extant population remains.,"Myiagra freycineti was endemic to Guam (to USA), where it was once common but restricted to the northern plateau by the 1970s (Jenkins 1983, Hume 2017).",,Terrestrial,,Oceanian,Global
231059236,22724444,Pomarea pomarea,ANIMALIA,CHORDATA,PASSERIFORMES,AVES,MONARCHIDAE,Extinct,1823,2023,2023-03-27 00:00:00 UTC,3.1,English,"This species was endemic to the island of Maupiti, French Polynesia, but is now Extinct as a result of habitat loss and the action of invasive species. It has not been recorded since the type specimen was collected in 1823.",It is likely to have inhabited forest at all altitudes.,The Society Islands have lost most of their original vegetation and their avifauna has suffered greatly through competition and predation from introduced species (Todd 1984); these factors are likely to have caused its extinction.,No extant population remains.,"Pomarea pomarea is known only from the type specimen, collected on Maupiti, Society Islands, French Polynesia, by Jules de Blosseville in 1823 (Holyoak and Thibault 1984). It presumably became extinct soon after, as it has not been recorded since.",,Terrestrial,,Oceanian,Global
232856457,232856397,Coregonus obliterus,ANIMALIA,CHORDATA,SALMONIFORMES,ACTINOPTERYGII,SALMONIDAE,Extinct,1939,2024,2023-11-03 00:00:00 UTC,3.1,English,"Global and European regional assessment: Extinct (EX)EU 27 regional assessment: Not RecordedThe Obliterated Whitefish was endemic to Europe, where it occurred in Lake Zug, Switzerland. The species has not not been observed in the wild since the early 20th century and no ex situ subpopulations exist. The species is therefore assessed as Extinct.","Lake Zug is a meromictic, perialpine, naturally oligotrophic lake formed after the last glacial period. It has a maximum depth of 197 metres, and is subdivided by a peninsula into a deep southern basin with steep slopes and a shallower northern basin.Three whitefish species which differed in traits related to feeding and reproductive ecology along depth gradients were formerly endemic to the lake, two of which are now extinct.The Obliterated Whitefish is understood to have been a profundal specialist feeding on benthic prey.The annual reproductive period probably extended from mid-September to mid-October, and spawning took place in the deeper parts of the lake.","Discharge of urban waste water and agricultural runoff into its tributary rivers caused Lake Zug to become increasingly eutrophic from the early 19th century onwards, and by the early 1980s it was among the most polluted lakes in Switzerland.These conditions are believed to have driven the extinction of the Obliterated Whitefish and Zug Whitefish (Coregonus zugensis) due to depletion of oxygen in the water column below c. 100 metres depth, leading to their profundal spawning sites becoming inaccessible.The Enduring Whitefish (Coregonus supersum) is the only endemic congener that remains extant in the lake, and is likely to have survived because it is able to complete its life cycle in comparatively shallow water.A secondary outcome of such changes in the available range of spawning depths is the potential for overlap and increased gene flow between different whitefish species that were formerly segregated along depth gradients. This raises the possibility of speciation reversal and extinction events due to hybridisation and introgression, which have been observed in some other Swiss lakes but not yet studied in Lake Zug.","Fisheries records suggest that this species was declining by the 1870s, and became extinct prior to 1950.","This species was endemic to Lake Zug (fr. Lac de Zug; de. Zugersee) in the upper Rhine River system, Switzerland.",This species was formerly harvested on a commercial basis.,Freshwater (=Inland waters),,Palearctic,Global & Europe
235578991,22708835,Turdus ravidus,ANIMALIA,CHORDATA,PASSERIFORMES,AVES,TURDIDAE,Extinct,1938,2023,2023-05-23 00:00:00 UTC,3.1,English,"This species was known from the island of Grand Cayman, but it has been driven to extinction by logging of its forest habitat. The last sight records date from 1938, and it was definitely Extinct by 1965.","Its habitat was dense ""knife-edged coral-rock, swamp, and mangroves, with patches here and there of the poisonous manchineel tree and of climbing cactus"" (Savage English 1916).","The reasons for the species' disappearance are not fully clear. It presumably declined as the island's forests were progressively cleared (Johnston 1969, Larsen 2020). Further contributing factors may be severe hurricanes and the introduction of non-native mammals, including feral cats (Larsen 2020).",No extant population remains.,"Turdus ravidus is known from four collections (21 specimens in total) from Grand Cayman, Cayman Islands (to UK). The last specimens were collected (by W. W. Brown) in 1911 (Bangs 1916), and the last sight record (by C. B. Lewis) was in 1938 (Johnston 1969). It was extinct by 1965 (Bradley 2000).",,Terrestrial,,Neotropical,Global
235580956,22698593,Traversia lyalli,ANIMALIA,CHORDATA,PASSERIFORMES,AVES,ACANTHISITTIDAE,Extinct,1894,2023,2023-05-22 00:00:00 UTC,3.1,English,"This species was known from Stephens Island, New Zealand, but likely became Extinct in 1895. Predation by feral cats is thought to have driven its decline.",The species was flightless and restricted to the rocky ground (Millener 1989).,"Construction of a lighthouse on Stephens Island in 1894 led to the clearance of most of the island's forest, with predation by feral cats driving the species to extinction (Tyrberg and Milberg 1991, Hume 2017).",No extant population remains.,"Traversia lyalli is only known from recent times from Stephens Island, New Zealand (Greenway 1967), although it is common in fossil deposits from both of the main islands (Worthy and Holdaway 1994). It was last recorded in 1894, when several were caught by the lighthouse keeper's cat (Hume 2017). It was extinct by November 1895, but it had survived into that year, with Henry Travers finding a cat-caught specimen in February (Tennyson and Martinson 2006).",,Terrestrial,,Australasian,Global
238086085,62307504,Eclectus infectus,ANIMALIA,CHORDATA,PSITTACIFORMES,AVES,PSITTACIDAE,Extinct,1793,2023,2023-06-16 00:00:00 UTC,3.1,English,"This species may have survived as recently as the late 18th century, but became Extinct most likely as a result of over-hunting and predation by invasive mammals.",Nothing directly relating to the habits of this lost species is known.,This species was presumably driven to extinction by overhunting and predation from introduced mammals (Hume 2017).,None remain.,"Eclectus infectus was described by D. W. Steadman (2006a) from bones found at archaeological (late Holocene) and paleontological (late Pleistocene) sites on three islands in Tonga, and presumably relates to a drawing of a parrot from the Malaspina expedition to Vava’u, Tonga in 1793 (Steadman 2006b, Olson 2006), soon after which time it presumably became extinct. It may possibly have also occurred on Vanuatu and Fiji (Hume and Walters 2012).",Over-hunting presumably played a role in this species' extinction (Hume 2017).,Terrestrial,,Oceanian,Global
